{
  "$schema": "https://json-schema.org/draft/2020-12/schema",
  "type": "object",
  "required": [
    "schemaVersion",
    "kind",
    "id",
    "version",
    "title",
    "purpose",
    "license",
    "maintainer",
    "stacks",
    "filesystemScope",
    "networkScope",
    "requiredTools",
    "inputs",
    "outputs",
    "exampleTasks",
    "knownLimitations",
    "entry"
  ],
  "properties": {
    "schemaVersion": {
      "const": "1"
    },
    "kind": {
      "const": "Skill"
    },
    "id": {
      "type": "string",
      "pattern": "^[a-z][a-z0-9-]*/[a-z][a-z0-9-]*$"
    },
    "version": {
      "type": "string",
      "pattern": "^(0|[1-9][0-9]*)\\.(0|[1-9][0-9]*)\\.(0|[1-9][0-9]*)$"
    },
    "title": {
      "type": "string",
      "minLength": 1
    },
    "purpose": {
      "type": "string",
      "minLength": 1
    },
    "license": {
      "type": "string",
      "minLength": 1
    },
    "maintainer": {
      "type": "object",
      "required": [
        "name",
        "contact"
      ],
      "properties": {
        "name": {
          "type": "string",
          "minLength": 1
        },
        "contact": {
          "type": "string",
          "minLength": 1
        }
      },
      "additionalProperties": false
    },
    "stacks": {
      "type": "array",
      "items": {
        "type": "string",
        "minLength": 1
      }
    },
    "filesystemScope": {
      "type": "object",
      "required": [
        "read",
        "write",
        "deny"
      ],
      "properties": {
        "read": {
          "type": "array",
          "items": {
            "type": "string",
            "minLength": 1
          }
        },
        "write": {
          "type": "array",
          "items": {
            "type": "string",
            "minLength": 1
          }
        },
        "deny": {
          "type": "array",
          "items": {
            "type": "string",
            "minLength": 1
          }
        }
      },
      "additionalProperties": false
    },
    "networkScope": {
      "type": "object",
      "required": [
        "mode",
        "destinations",
        "externalWriteAllowed"
      ],
      "properties": {
        "mode": {
          "enum": [
            "none",
            "allowlist"
          ]
        },
        "destinations": {
          "type": "array",
          "items": {
            "type": "string",
            "minLength": 1
          }
        },
        "externalWriteAllowed": {
          "type": "boolean"
        }
      },
      "additionalProperties": false
    },
    "requiredTools": {
      "type": "array",
      "items": {
        "type": "string",
        "minLength": 1
      }
    },
    "inputs": {
      "type": "array",
      "items": {
        "type": "string",
        "minLength": 1
      },
      "minItems": 1
    },
    "outputs": {
      "type": "array",
      "items": {
        "type": "string",
        "minLength": 1
      },
      "minItems": 1
    },
    "exampleTasks": {
      "type": "array",
      "items": {
        "type": "string",
        "minLength": 1
      },
      "minItems": 1
    },
    "knownLimitations": {
      "type": "array",
      "items": {
        "type": "string",
        "minLength": 1
      },
      "minItems": 1
    },
    "entry": {
      "const": "SKILL.md"
    }
  },
  "additionalProperties": false,
  "allOf": [
    {
      "if": {
        "properties": {
          "networkScope": {
            "properties": {
              "mode": {
                "const": "none"
              }
            }
          }
        }
      },
      "then": {
        "properties": {
          "networkScope": {
            "properties": {
              "destinations": {
                "maxItems": 0
              },
              "externalWriteAllowed": {
                "const": false
              }
            }
          }
        }
      }
    }
  ]
}
