{
  "schemaVersion": "1",
  "version": "0.1.0",
  "license": "Apache-2.0",
  "maintainer": {
    "name": "sha-shank-03",
    "contact": "https://github.com/sha-shank-03"
  },
  "stacks": [
    "ios",
    "swift"
  ],
  "kind": "Skill",
  "id": "core/ios-test-plan",
  "title": "iOS Test Plan",
  "purpose": "Plan checks for a supplied synthetic change without claiming test execution.",
  "entry": "SKILL.md",
  "filesystemScope": {
    "read": [
      "${workspace}/inputs/**"
    ],
    "write": [],
    "deny": [
      "${workspace}/secrets/**",
      "${workspace}/.env*"
    ]
  },
  "networkScope": {
    "mode": "none",
    "destinations": [],
    "externalWriteAllowed": false
  },
  "requiredTools": [
    "repository.read"
  ],
  "inputs": [
    "Supplied change and acceptance criteria"
  ],
  "outputs": [
    "Test plan and explicit evidence gaps"
  ],
  "exampleTasks": [
    "Plan checks for a synthetic settings toggle."
  ],
  "knownLimitations": [
    "Planning does not execute tests or prove release readiness."
  ]
}
